<?xml version="1.0" encoding="UTF-8" standalone="no"?>
<!DOCTYPE Data SYSTEM "DataDTD.dtd">
<Data>
    <Settings>
        <Name1>Sascha</Name1>
        <Name2>Saskia</Name2>
        <TextSize>18</TextSize>
        <SizeX>896</SizeX>
        <SizeY>566</SizeY>
        <Language>de</Language>
    </Settings>
    <Game>
        <GName>Test</GName>
        <GPlatform>PC</GPlatform>
        <GStatus>Finished</GStatus>
    </Game>
    <Game>
        <GName>Test1</GName>
        <GPlatform>PC_VR</GPlatform>
        <GStatus>Pending</GStatus>
    </Game>
    <Game>
        <GName>Test2</GName>
        <GPlatform>Nintendo Switch</GPlatform>
        <GStatus>Pending</GStatus>
    </Game>
    <Series>
        <SName>Test</SName>
        <SPlatform>BluRay</SPlatform>
        <Seasons>8</Seasons>
        <SStatus>Season 3</SStatus>
    </Series>
    <Series>
        <SName>Test1</SName>
        <SPlatform>DVD</SPlatform>
        <Seasons>9</Seasons>
        <SStatus>Season 1</SStatus>
    </Series>
    <Series>
        <SName>Test2</SName>
        <SPlatform>Netflix</SPlatform>
        <Seasons>5+</Seasons>
        <SStatus>Season 2</SStatus>
    </Series>
    <Game>
        <GName>Test6</GName>
        <GPlatform>PC</GPlatform>
        <GStatus>Pending</GStatus>
    </Game>
    <Series>
        <SName>13 Reasons Why</SName>
        <SPlatform>Netflix</SPlatform>
        <Seasons>4</Seasons>
        <SStatus>Season 3</SStatus>
    </Series>
    <Game>
        <GName>Detroid: Become Human</GName>
        <GPlatform>PS4</GPlatform>
        <GStatus>Finished</GStatus>
    </Game>
    <Series>
        <SName>TestSerie</SName>
        <SPlatform>Netflix</SPlatform>
        <Seasons>8</Seasons>
        <SStatus>Finished</SStatus>
    </Series>
    <Activity>
        <Description>Test</Description>
        <Location>Home</Location>
        <Category>Sport</Category>
        <AStatus>Pending</AStatus>
    </Activity>
    <Movie>
        <MName>TestMovie</MName>
        <Suggested>Sascha</Suggested>
        <MStatus>Pending</MStatus>
    </Movie>
    <Series>
        <SName>Peter</SName>
        <SPlatform/>
        <Seasons/>
        <SStatus>Finished</SStatus>
    </Series>
    <Series>
        <SName/>
        <SPlatform/>
        <Seasons/>
        <SStatus/>
    </Series>
    <Activity>
        <Description>TestActivity</Description>
        <Location/>
        <Category/>
        <AStatus/>
    </Activity>
    <Activity>
        <Description>TestActivity1</Description>
        <Location/>
        <Category/>
        <AStatus>Pending</AStatus>
    </Activity>
    <Game>
        <GName>Testitest</GName>
        <GPlatform/>
        <GStatus/>
    </Game>
    <Game>
        <GName>Endgame</GName>
        <GPlatform>PS4</GPlatform>
        <GStatus>Finished</GStatus>
    </Game>
    <Game>
        <GName>EA Games</GName>
        <GPlatform>PC</GPlatform>
        <GStatus>Pending</GStatus>
    </Game>
    <Movie>
        <MName>Abba</MName>
        <Suggested>Sascha</Suggested>
        <MStatus>Pending</MStatus>
    </Movie>
    <Movie>
        <MName>Zeus</MName>
        <Suggested>Saskia</Suggested>
        <MStatus>Pending</MStatus>
    </Movie>
</Data>
